N,Годы,Название,Историческая справка,Страна
556,(AD 1371–1395),ПРИЛЕПСКОЕ КОРОЛЕВСТВО,"ПРИЛЕПСКОЕ КОРОЛЕВСТВО (AD 1371–1395) Государство, феодальное, монархическое. Зародилось на терр. совр. Македонии в результате распада Сербского царства. Завоевано Османским эмиратом. Столица — Прилеп",Албания Греция Македония Сербия
315,(AD 855–879),ПРОВАНС,"ПРОВАНС (AD 855–879) Государство, феодальное, монархическое (Королевство Прованс). Зародилось на терр. совр.Франции в результате в результате раздела Срединного Франкского Королевства. Столица — Арль. Переименовано в Королевство Нижняя Бургундия.",Италия Монако Франция Швейцария
915,(AD 1869–1963),"ПРОТЕКТОРАТ АДЕН (брит.)





PROTECTORATE ADEN (UK)","ПРОТЕКТОРАТ АДЕН (брит.) (AD 1869–1963) Государство под протекторатом Великобритании. Образовано на терр. совр. Йемена в результате установления протектората Великобритании над султанатами и шейхствами Южной Аравии. Столица — Аден. Преобразован в Протекторат Южной Аравии (брит.)

PROTECTORATE ADEN (UK) (AD 1869–1962) State under British protectorate. Formed on the territory of Yemen as a result of the establishment of a British protectorate over the sultanates and sheikhdoms South Arabia. Capital — Aden. Сonverted Protectorate of South Arabia (UK)",Йемен
917,(AD 1963–1967),"ПРОТЕКТОРАТ ЮЖНОЙ АРАВИИ (брит.)



PROTECTORATE OF SOUTH ARABIA (UK)","ПРОТЕКТОРАТ ЮЖНОЙ АРАВИИ (брит.) (AD 1963–1967) Государство под протекторатом Великобритании. Образовано на терр. совр. Йемена в результате преобразования Протектората Аден (брит.). Вошло в состав Народной Республика Южного Йемена

PROTECTORATE OF SOUTH ARABIA (UK) (AD 1963–1967) State under British protectorate. Formed on the territory of Yemen as a result of сonverted Aden Protectorate (UK). Became part of the People's Republic of South Yemen",Йемен
367,(AD 1701–1871),ПРУССИЯ,"ПРУССИЯ (AD 1701–1871) Государство, монархическое (Королевство Пруссия). Образовалось на терр. совр. Германии в результате преобразования Курфюршества Бранденбург-Пруссия, входившего в состав Священной Римской империи (формально оставалась в составе Священной Римской Империи). Вошло в состав объединенной Германии. Столица — Берлин.","Белоруссия Германия Дания Литва Польша Россия
Россия(Калининград)
Швейцария Швеция"
721,(AD 1348–1510),ПСКОВСКАЯ РЕСПУБЛИКА,"ПСКОВСКАЯ РЕСПУБЛИКА (AD 1348–1510) Государство, феодальное, республика. Зародилось на терр. совр. России в результате отделения от Новгородской Республики (иго). Присоединено к Московскому княжеству. Столица — Псков",Россия (СЗФО)
341,(AD 1399–1801),ПЬОМБИНО,"ПЬОМБИНО (AD 1399–1801) Государство, феодальное, монархическое (с 1594 — Княжество Пьомбино). Зародилось на терр. совр. Италии в результате отделения от Пизанской Республики (формально входило в состав Священной Римской Империи). Столица — Пьомбино. Присоединено к Королевству Этрурия",Италия
555,"(AD 825–917},{1170–1346)",РАШКА,"РАШКА (AD 825–917},{1170–1346) Государство, феодальное, монархическое (до 1217 — княжество, с 1217 — королевство). (Зародилось на терр. совр. Сербии в результате отделения от Первого Болгарского царства. Вошло в состав Первого Болгарского царства},{Отделилось от Византийской империи. Вошло в состав Сербского царства). Столица — Стари-Рас",Албания Босния и Герцеговина Македония Сербия Хорватия Черногория
598,(AD 450–638),РЕГЕД,"РЕГЕД (AD 450–638) Государство, феодальное, монархическое. Основано бриттами на терр. совр. Великобритании (в Шотландии). Столица — Карлайл. Завоевано Нортумбрией.",Великобритания
970,(AD 1325–1448),РЕДДИ,"РЕДДИ (AD 1325–1448) Государство, феодальное, монархическое. Зародилось на терр. совр.Индии после распада Какатии. Столицы — Адданки. Завоевано Виджаянагарой",Индия
409,(AD 1806–1871),РЕЙСС,"РЕЙСС (AD 1806–1871) Государство, монархическое (Княжество Рейсс). Образовалось на терр. совр.Германии в результате ликвидации Священной Римской империи (состояло из четырех частей: Княжества Рейсс-Эберсдорф, Рейсс-Грейц, Рейсс-Лобенштайн, Рейсс-Шлейц; в 1848 преобразованы в два княжества: Рейсс младшей линии и Рейсс старшей линии ). В 1807–1813 — член Рейнского союза, в 1815–1866 — член Германского союза, в 1867–1871 — член Северогерманского союза. Вошло в состав объединенной Германии). Столица — Гера",Германия
510,(AD 1800–1807),РЕСПУБЛИКА СЕМИ ОСТРОВОВ,"РЕСПУБЛИКА СЕМИ ОСТРОВОВ (AD 1800–1807) Государство греческое, протекторат Османской империи (фактически протекторат Российской империи). Образовалось на терр. совр. Греции в результате освобождения Ионических островов российской эскадрой. Столица — нет. Вошло в состав Франции, с 1809 г. — в состав Иллирийских провинций (фр.)).",Греция
386,(AD 1581–1795),РЕСПУБЛИКА СОЕДИНЕННЫХ ПРОВИНЦИЙ,"РЕСПУБЛИКА СОЕДИНЕННЫХ ПРОВИНЦИЙ (AD 1581–1795) Государство, республиканское. Образовалось на терр. совр. Нидерландов в результате победы Нидерландской буржуазной революции и отделения от Священной Римской империи. Преобразована в Батавскую Республику в результате Наполеоновских войн. Столица — Гаага.",Германия Нидерланды
457,(AD 1569–1795),РЕЧЬ ПОСПОЛИТАЯ,"РЕЧЬ ПОСПОЛИТАЯ (AD 1569–1795) Государство, феодальное, монархическое, конфедерация. Зародилось на терр. совр. Польши в результате объединения Королевства Польша и Великого княжества Литовского. Разделено между Пруссией, Габсбургской империей и Российской империей. Столицы — Краков (до 1596), Варшава","Белоруссия Латвия Литва Молдавия Польша Россия
(Калининград)
(ЦФО) (СЗФО) Украина Эстония"
635,(AD 1201–1561),РИЖСКОЕ АРХИЕПИСКОПСТВО,"РИЖСКОЕ АРХИЕПИСКОПСТВО (AD 1201–1561) Государство, феодальное, теократическое, подчинялось Папе римскому (до 1255 — Рижское епископство, с 1207 — в составе княжества Терра Мариана, с 1435 в составе Ливонской конфедерации (в составе Священной Римской империи)). Образвано на терр. совр.Латвии в результате переименования Ливонского епископства. Столица — Рига. Завоевано Великим княжеством Литовским",Латвия
295,(754–509 BC),РИМ,"РИМ (754–509 BC) Город-государство, рабовладельческий, монархический. Основан древними латинами на терр. совр. Италии Преобразован в Римскую Республику. Легегдарный основатель и правитель — Ромул {754–716}",Ватикан Италия
49,(27 BC – AD 395),РИМСКАЯ ИМПЕРИЯ,"РИМСКАЯ ИМПЕРИЯ (27 BC – AD 395) Государство, рабовладельческое, монархическое. Образовано на терр. совр. Италии в результате установления монархии в Римской республике. Столица — Рим. Разделилась на Западную Римскую Империю и Восточную Римскую Империю.","Австрия Албания Алжир Андорра Бельгия Болгария Босния и Герцеговина Ватикан Великобритания Венгрия Германия Гибралтар Греция Грузия Египет Израиль Иордания Ирак Испания
Италия Кипр Ливан Ливия Лихтенштейн Люксембург Македония Мальта Марокко Нидерланды Португалия Румыния Саудовская Аравия Сан-Марино Сирия Словения Тунис Турция Франция Хорватия Швейцария"
48,(509–27 BC),РИМСКАЯ РЕСПУБЛИКА,"РИМСКАЯ РЕСПУБЛИКА (509–27 BC) Государство, рабовладельческое, форма правления республика. Зародилось на терр. Италии . Основана в результате свержения царя в Риме (древнем). Столица — Рим. Преобразована в монархию — Римская империя.",Австрия Албания Алжир Андорра Бельгия Болгария Босния и Герцеговина Ватикан Великобритания Германия Гибралтар Греция Грузия Египет Израиль Иордания Ирак Испания Италия Кипр Ливан Ливия Лихтенштейн Люксембург Македония Мальта Марокко Монако Нидерланды Португалия Румыния Сан-Марино Сербия Сирия Словения Тунис Турция Франция Хорватия Черногория Швейцария Португалия
350,(AD 1798–1799),РИМСКАЯ РЕСПУБЛИКА (НАПОЛЕОН),"РИМСКАЯ РЕСПУБЛИКА (НАПОЛЕОН) (AD 1798–1799) Государство, дочерняя республика Франции. Образовано на терр. совр. Италии в результате ликвидации Наполеоном Папской области. Ликвидировано в результате восстановления Папской области. Столица — Рим.",Ватикан Италия
213,(AD 1921–1926),РИФСКАЯ РЕСПУБЛИКА,"РИФСКАЯ РЕСПУБЛИКА (AD 1921–1926) Государство, капиталистическое (Конфедеративная республика племён Эр-Рифа). Образовано на терр. совр. Марокко в результате провозглашения независимости племён Эр-Рифа вот главе с Абд аль-Кримом на территории Испанского Марокко. Включено в состав Испанского Марокко.",Марокко
43,"(408-340 BC},{190 BC – AD 44)",РОДОС,"РОДОС (408-340 BC},{190 BC – AD 44) Государство, рабовладельческое. (Образовалось на терр. совр. Греции в результате объединения городов о. Родос. Завоевано Персидской империей Ахеменидов}.{Вышло из состава Государства Селевкидов. Вошло в состав Римской Империи). Столица — Родос.",Греция Турция
105,(AD 1721–1917),РОССИЙСКАЯ ИМПЕРИЯ,"РОССИЙСКАЯ ИМПЕРИЯ (AD 1721–1917) Государство, монархическое. Сложилось на терр. совр. России основе Русского царства, которое Петр I объявил империей. Столица — Санкт-Петербург. В результате Февральской Революции провозглашена Российская Республика.","Белоруссия Грузия Иран Казахстан Киргизстан Латвия Литва Молдавия Польша Румыния Турция Норвегия Россия, (ДФО), (ПФО), (СЗФО), (СибФО), (УФО), (ЦФО), (ЮФО), Таджикистан Туркменистан Узбекистан Украина Финляндия Эстония"
461,"(AD 1917, февраль–1917, октябрь)",РОССИЙСКАЯ РЕСПУБЛИКА,"РОССИЙСКАЯ РЕСПУБЛИКА (AD 1917, февраль–1917, октябрь) Государство, капиталлистическое. Образовалось на терр. совр.Россиив результате ликвидации монархии в Российской империи во время Февральской революции. Преобразовано в Советскую Россию (РСФСР) в результате государственного переворота (Октябрьская революция). Столица — Петроград","Белоруссия Грузия Казахстан Киргизстан Латвия Литва Молдавия Польша Россия, (ДФО), (ПФО), (СЗФО), (СибФО), (УФО), (ЦФО), (ЮФО), Таджикистан Туркменистан Турция Узбекистан Украина Финляндия Эстония"
706,(AD 1991–),РОССИЯ (AD 1991–),"РОССИЯ (AD 1991–) Государство, республика (Российская Федерация). Образовано в результате распада СССР. Столица — Москва","Белоруссия Россия, Калининградская обл., (ДФО), (ПФО), (СЗФО), (СибФО), (УФО), (ЦФО), (ЮФО)"
709,(AD 1364–1474),РОСТОВСКОЕ КНЯЖЕСТВО (иго),"РОСТОВСКОЕ КНЯЖЕСТВО (иго) (AD 1364–1474) Государство, феодальное, славянское. Вассал Золотой Орды. Зародилось на терр. совр. России в результате отделения от Владимирского княжества (иго). Присоединено к Московскому княжеству. Столица — Ростов",Россия Россия (ЦФО)
1007,(AD 1799–1867),РУССКАЯ АМЕРИКА,РУССКАЯ АМЕРИКА (AD 1799–1867) Владение Российской империи. Образовано в результате основания Российско-американской компании колоний на Аляске на территории совр. США . Столица — Новоархангельск. Продано США.,США
631,(AD 1547–1721),РУССКОЕ ЦАРСТВО,"РУССКОЕ ЦАРСТВО (AD 1547–1721) Государство, феодальное, монархическое. Зародилось на терр. совр. России в результате преобразования результате коронации великого князя Московского Ивана IV Грозного царем. Преобразовано в Российскую империю Петром I. Столица — Москва","Болгария Казахстан Молдавия Россия, (ДФО), (ПФО), (СЗФО), (СибФО), (УФО), (ЦФО), (ЮФО), Румыния Украина Финляндия"
545,(AD 1862–),РУМЫНИЯ,"РУМЫНИЯ (AD 1862–) Государство, капиталистическое, республика (до 1947 — монархия, Королевство (до 1881 — Княжество) Румыния) (Республика Румыния; в 1946–1989 — Социалистическая Республика Румыния, до 1965 — Румынская Народная Республика). Зародилось на терр. совр. Румынии в результате преобразования Объединенного княжества Валахии и Молдавии в Королевство Румыния. Столица — Бухарест",Болгария Молдавия Румыния Украина
703,"(AD 1129–1240},{AD 1480–1521)",РЯЗАНСКОЕ КНЯЖЕСТВО,"РЯЗАНСКОЕ КНЯЖЕСТВО (AD 1129–1240},{AD 1480–1521) Государство, феодальное, славянское (Рязанское княжество, Муромо-Рязанское княжество, Рязанское великое княжество). (Зародилось на терр. совр. России в результате отделения от Черниговского княжества. Попало под татаро-монгольское иго},{Вернуло независимость. Присоединено к Московскому княжеству). Столицы — Рязань, Переяславль-Рязанский","Россия, (ЦФО), (ПФО)"
704,(AD 1240–1480) ),РЯЗАНСКОЕ КНЯЖЕСТВО (иго),"РЯЗАНСКОЕ КНЯЖЕСТВО (иго) (AD 1240–1480) Государство, феодальное, славянское. Вассал Золотой Орды. Образовано на терр. совр. России в результате попадания Рязанского княжества под татаро-монгольское иго. Вернуло независимость. Столица — Чернигов","Россия, (ЦФО), (ПФО)"
432,(AD 1920–1935),СААР,СААР (AD 1920–1935) Территория под управлением Лиги наций. Образовалось на терр. совр. Германии в результате отделения от Германии после поражения Германии в 1-й мировой войне. Вошла в состав Германии. Столица — Саарбрюккен,Германия
437,(AD 1945–1956),СААР (фр.),СААР (фр.) (AD 1945–1956) Протекторат Франции. Образовался на терр. совр.Германии в результате оккупации территории Францией в результате поражения Германии во 2-й мировой войне. Вошел в состав Германии. Столица — Саарбрюккен,Германия
903,"(1200–25 BC},{AD 100–270)","САБА

SABA","САБА (1200–25 BC},{AD 100–270) Государство, рабовладельческое, монархическое (Сабейское царство). (Зародилось на терр. совр. Йемена в результате переселения племен сабеев из северо-западной Аравии. Завоевано Химьяром},{Отделилось от Химьяра. Завоевано Химьяром). Столицы — Мариб, Сана. Визит правительницы Сабейского царства Билкис (царицы Савской) к царю Соломону описан в Библии

SABA (1200–25 BC},{AD 100–270) State, slave, monarchical (Sabaean Kingdom). (Arose in the territory of Yemen as a result of the relocation of tribes Sabeans from northwestern Arabia. Сonquered by Himyar}, {Separated from Himyar.Сonquered by Himyar). Capitals — Marib, Sanaa. Visit ruler Sabaean kingdom Bilqis (Queen of Saba) to King Solomon described in the Bible",Йемен
278,(AD 1416–1720),САВОЙСКОЕ ГЕРЦОГСТВО,"САВОЙСКОЕ ГЕРЦОГСТВО (AD 1416–1720) Государство, монархическое. Зародилось на терр. совр.Италии в результате отделения от Священной Римской Империи (формально оставалась в составе Священной Римской Империи). Столица — Турин (до 1653 — Шамбери). Преобразовано в Сардинское Королевство",Италия Швейцария Франция
157,(4000–3500 BC),САИС,"САИС (4000–3500 BC) Город-государство (ном), рабовладельческий, монархический.Создан древними египтянами на терр. совр. Египта. Вошел в состав Нижнего Египта.",Египет
415,(AD 1806–1871),САКСЕН-ВЕЙМАР,"САКСЕН-ВЕЙМАР (AD 1806–1871) Государство, монархическое (Герцогство Саксен-Веймар; до 1809 было разделено на два герцогства Саксен-Веймар и Саксен-Айзенах). Образовалось на терр. совр. Германии в результате ликвидации Священной Римской империи (в составе Священной Римской империи образовано в 1572). В 1806–1813 — член Рейнского союза, 1815–1866 — член Германского союза, в 1867–1871 — член Северогерманского союза. Вошло в состав объединенной Германии. Столица — Веймар",Германия
412,(AD 1806–1826),САКСЕН-ГОТА-АЛЬТЕНБУРГ,"САКСЕН-ГОТА-АЛЬТЕНБУРГ (AD 1806–1826) Государство, монархическое (Герцогство Саксен-Гота-Альтенбург). Образовалось на терр. совр. Германии в результате ликвидации Священной Римской империи (в составе Священной Римской империи образовано в 1680). В 1806–1813 — член Рейнского союза, в 1815–1826 — член Германского союза. Объединилось с Герцогством Саксен-Кобург-Заальфельд в Герцогство Саксен-Кобург и Гота. Столица — Гота",Германия
