N,Годы,Название,Историческая справка,Страна
172,(AD 1237–1574),ГОСУДАРСТВО ХАФСИДОВ,"ГОСУДАРСТВО ХАФСИДОВ (AD 1237–1574) Государство, феодальное теократическое арабо-мусульманское. Образовано на терр. совр. Туниса на части территории Государства Альмохадов. Столица — Тунис. Завоевано Османской Империей.",Алжир Ливия Тунис
793,(AD 1097–1231),"ГОСУДАРСТВО ХОРЕЗМШАХОВ

Khwarazmian Empire","ГОСУДАРСТВО ХОРЕЗМШАХОВ (AD 1097–1231) Государство, феодальное, монархическое. Зародилось на терр. совр. Узбекистанa в результате отделения от Сельджукского государства. Завоевано Монгольской империей. Столицы — Гургандж (1097–1220), Самарканд (1212–1220), Газни (1220–1221), Дели (1221–1225), Тебриз (1225–1231)",Азербайджан Афганистан Иран Казахстан Киргизстан Пакистан Таджикистан Туркменистан Узбекистан
77,(AD 1256–1353),"ГОСУДАРСТВО ХУЛАГУИДОВ

Ilkhanate","ГОСУДАРСТВО ХУЛАГУИДОВ (AD 1256–1353) Государство, феодальное. Образовано на терр. совр. Ирана в результате отделения от Монгольской империи внуком Чингисхана Хулагу-ханом. Столицы — Марага, Тебриз, Сольтание. Распалось на несколько государств (Государство Джалаиридов, Государство Мозафферидов и др.)","Азербайджан Афганистан Армения Бахрейн Грузия Ирак Иран Кувейт Пакистан Россия, (ЮФО), Таджикистан Туркменистан Турция"
794,(AD 1335–1357),ГОСУДАРСТВО ЧОБАНИДОВ,"ГОСУДАРСТВО ЧОБАНИДОВ (AD 1335–1357) Государство, феодальное. Зародилось на терр. совр. Ирана в результате распада Государства Хулагуидов. Завоевано Государством Джалаиридов. Столица — Тебриз",Азербайджан Иран
75,(AD 1100–1207),ГОСУДАРСТВО ШАХАРМЕНОВ,"ГОСУДАРСТВО ШАХАРМЕНОВ (AD 1100–1207) Государство, феодальное. Образовано на терр. совр.Турции в результате отделения от Сельджукского Государства. Столица — Ахлат. Завоевано Государством Айюбидов",Турция
717,(AD 1382–1538),ГОСУДАРСТВО ШИРВАНШАХОВ,"ГОСУДАРСТВО ШИРВАНШАХОВ (AD 1382–1538) Государство, феодальное, монархическое. Зародилось на терр. совр. Азербайджана в результате отделения от Государства Джалаиридов. Столица — Шемаха. Завоевано Персидской Империей Сефевидов.","Азербайджан Россия, (ЮФО)"
811,(AD 420–567),"ГОСУДАРСТВО ЭФТАЛИТОВ

Hephthalite Empire","ГОСУДАРСТВО ЭФТАЛИТОВ (AD 420–567) Государство, рабовладельческое, монархическое. Зародилось на терр. совр. Афганистана в результате завоевания эфталитами (белыми гуннами) части территории Персидской империи Сасанидов. Столица — Хуа. Завоевано Персидской империей Сасанидов.",Афганистан Индия Иран Казахстан Киргизстан Пакистан Таджикистан Туркменистан Узбекистан
231,(AD 1526–1804),ГРАНАДСКИЙ ЭМИРАТ,"ГРАНАДСКИЙ ЭМИРАТ (AD 1012-1090},{1238–1492) Государство, феодальное теократическое арабо-мусульманское. (Зародилось на терр. совр.Испании в результате распада Кордовского Халифата (Эмират Зиридов). Завоевано Государством Альморавидов},{Воссоздано в результате распада Государства Альмохадов. Завоевано Испанией) Столица — Гранада.",Гибралтар Испания Португалия
968,(AD 1189–1317),ГОСУДАРСТВО ЯДАВОВ,"ГОСУДАРСТВО ЯДАВОВ (AD 1189–1317) Государство, феодальное, монархическое. Зародилось на терр. совр. Индии после распада Западных Чалукья. Столица — Девагири. Завоевано Делийским султанатом",Индия
231,(AD 1071-1130),ГРАФСТВО СИЦИЛИЯ,"ГРАФСТВО СИЦИЛИЯ (AD 1071-1130) Государство, феодальное, монархическое. Зародилось на терр. совр.Италии в результате завоевания норманнами части Сицилийского Эмирата. Столица — Палермо. В результате объединения Герцогство Апулия и Калабрия и Графства Сицилия образовано Королевство Апулия и Сицилия",Италия Мальта Марокко
809,(256–125 BC),"ГРЕКО-БАКТРИЙСКОЕ ЦАРСТВО

Greco-Bactrian Kingdom","ГРЕКО-БАКТРИЙСКОЕ ЦАРСТВО (256–125 BC) Государство, эллинистическое рабовладельческое, монархическое. Зародилось на терр. совр. Афганистана в результате отделения от Государства Селевкидов. Столица — Бактры. Разрушено кочевыми племенами тохаров, наследники греко-бактрийских царей основали Индо-Греческое царство",Афганистан Индия Иран Казахстан Киргизстан Пакистан Таджикистан Туркменистан Узбекистан
513,"(AD 1830–1941},{1944–)",ГРЕЦИЯ,"ГРЕЦИЯ (AD 1830–1941},{1944–) Государство капиталлистическое (Греческая Республика, до 1973 — Королевство Греция). (Образовалось на терр. совр. Греции в результате отделения от Османской империи. Оккупировано Германией, Италией, Болгарией},{Освобождено от оккупации.) Столица — Афины",Греция
771,(AD 1918–1921),ГРУЗИНСКАЯ ДЕМОКРАТИЧЕСКАЯ РЕСПУБЛИКА,"ГРУЗИНСКАЯ ДЕМОКРАТИЧЕСКАЯ РЕСПУБЛИКА (AD 1918–1921) Государство, капиталлистическое. Образовано на терр. совр. Грузии в результате отделения от Советской России. Столица — Тбилиси. После ввода советских войск и провозглашения советской власти преобразована в Грузинскую ССР",Азербайджан Армения Грузия Турция
772,"(AD 1921–1922, март))",ГРУЗИНСКАЯ ССР,"ГРУЗИНСКАЯ ССР (AD 1921–1922, март) Государство, социалистическое (Грузинская Социалистическая Советская Республика). Образовано в результате установления советской власти в Грузинской Демократической Республике. Столица — Тбилиси. Вошло в состав Закавказской СФСР",Грузия
774,(AD 1991–),ГРУЗИЯ,"ГРУЗИЯ (AD 1991–) Государство, республика (Республика Грузия). Зародилось на терр.совр. Грузии в результате распада СССР. Столица — Тбилиси",Азербайджан Армения Грузия
63,"(AD 1008–1245},{1353–1466)",ГРУЗИНСКОЕ ЦАРСТВО,"ГРУЗИНСКОЕ ЦАРСТВО (AD 1008–1245},{1353–1466) Государство, грузинское феодальное, монархическое. Столица — Тбилиси. (Возникло на терр. совр. Грузии в результате объединения Багратом III грузинских земель на основе Тао-Кларджетского Княжества. Завоевано Монгольской Империей},{Восстановила независимость после распада Государства Хулагуидов. Распалось на государства: Картлийское Царство , Кахетинское Царство, Имеретинское Царство, Самцсхе-Саатабаго)","Азербайджан Армения Грузия Россия, (ЮФО), Турция"
976,(AD 1407–1573),ГУДЖАРАТСКИЙ СУЛТАНАТ,"ГУДЖАРАТСКИЙ СУЛТАНАТ (AD 1407–1573) Государство, феодальное, монархическое. Зародилось на терр. совр. Индии в результате отделения от Делийского султаната. Столицы — Анахильвар (1407–1411), Ахмадабад (1411–1484, 1535–1573) , Мухаммадабад (1484–1535). Завоевано Империей Великих Моголов",Индия
961,(AD 647–1036),ГУРДЖАРА-ПРАТИХАРА,"ГУРДЖАРА-ПРАТИХАРА (AD 647–1036) Государство, феодальное, монархическое. Зародилось на терр. совр. Индии в результате распада Империи Харша. Столица — Каннаудж. Завоевано Газневидским государством",Индия
754,(AD 1463–1555),ГУРИЙСКОЕ КНЯЖЕСТВО,"ГУРИЙСКОЕ КНЯЖЕСТВО (AD 1463–1555) Государство, феодальное, монархическое. Возникло на терр. совр.Грузии в результате распада Грузинского царства. Столица — Озургети. Попало в вассальную зависимость от Османской империи",Грузия
757,(AD 1555–1804),ГУРИЙСКОЕ КНЯЖЕСТВО(осм.),"ГУРИЙСКОЕ КНЯЖЕСТВО (осм.) (AD 1555–1804) Государство, феодальное, монархическое, вассал Османской империи. Возникло на терр. совр.Грузии в результате попадания Гурийского княжества в вассальную зависимость от Османской империи. Столица — Озургети. Вошло в состав Российской империи",Грузия
792,(AD 951–1071),ГЯНДЖИНСКИЙ ЭМИРАТ,"ГЯНДЖИНСКИЙ ЭМИРАТ (AD 951–1071) Государство, феодальное теократическое, мусульманское. Зародилось на терр. совр. Азербайджана в результате отделения от Государства Саларидов. Завоевано Сельджукским Государством. Столица — Гянджа.",Азербайджан
782,(AD 1747–1804),ГЯНДЖИНСКОЕ ХАНСТВО,"ГЯНДЖИНСКОЕ ХАНСТВО (AD 1747–1804) Государство, феодальное, монархическое. Зародилось на терр. совр.Азербайджана в результате отделения от Персидской державы Надир-шаха. Вошло в состав Российской империи. Столица — Гянджа.",Азербайджан Армения
541,(82 BC–AD 106),ДАКИЙСКОЕ ЦАРСТВО,"ДАКИЙСКОЕ ЦАРСТВО (82 BC–AD 106) Государство, рабовладельческое, монархическое. Зародилось на терр. совр. Румынии в результате объединения гето-дакийских племен. Завоевано Римской империей. Столица — Сармизегетуза",Болгария Молдавия Румыния Сербия Украина Хорватия
612,(AD 1711–1848),ДАЛ РИАДА,"ДАЛ РИАДА (AD 580–843) Государство, феодальное, монархическое. Основанно ирландцами на терр. совр.Великобритании (западное побережье Шотландиии и север Ирландии). Столица не определена. Объединилось с Королевством пиктов в Шотландию.",Великобритания
739,"(AD 1920–1922, ноябрь)",ДАЛЬНЕВОСТОЧНАЯ РЕСПУБЛИКА,"ДАЛЬНЕВОСТОЧНАЯ РЕСПУБЛИКА (AD 1920–1922, ноябрь) Формально независимое, демократическое капиталитстическое государство. Образовано на терр. совр. России в результате отделения от Советской России. Вошло в состав Советской России. Столица — Верхнеудинск; с октября 1920 — Чита.","Россия, (ДФО), (СибФО)"
130,(AD 1920–1925),ДАМАСК (фр.),"ДАМАСК (фр.) (AD 1920–1925) Мандатная территория Лиги наций под управлением Франции (Государство Дамаск). Образована на территории Сирии (зона брит.-фр. оккупации). Столица — Дамаск. Объединилось с Алеппо (фр.), образовав мандатную территорию Лиги наций под управлением Франции Сирию (фр.)",Сирия
618,(AD 870–954),ДАНЕЛАГ,"ДАНЕЛАГ (AD 870–954) Территория, отличающаяся особыми правовой и социальной системами (Область датского права), образованная в результате завоеваний датских викингов на терр. совр. Великобритании (в северо-восточной части Англии). Присоединена к Англии",Великобритания
66,(AD 1071–1157),ЭМИРАТ ДАНИШМЕНДИДОВ,"ЭМИРАТ ДАНИШМЕНДИДОВ (AD 1071–1157) Государство, феодальное.Образовано на терр. совр. Турции в результате передачи туркменскому военоначальнику Сельджукидов Данишменду Гази отвоеванных у Византийской Империи Сельджукским Государством части территорий. Заваоевано Конийским Султанатом",Турция
382,"(AD 935–1940},{1945–)",ДАНИЯ,"ДАНИЯ (AD 935–1940},{1945–) Государство монархическое (Королевство Дания). (Зародилось на терр. совр.Дании в результате слияния отдельных племенных групп в одно территориальное государство. Оккупировано Германией},{Восстановлено в результате победы антигитлеровской коалиции над Германией). Столица — Копенгаген",Великобритания Германия Дания Исландия Латвия Норвегия Польша Россия (СЗФО) Финляндия Эстония Швеция
8,(1000–700 BC),ГОСУДАРСТВО ДАНУНИТОВ,"ГОСУДАРСТВО ДАНУНИТОВ (1000–700 BC) Государство, рабовладельческое.Образовано данунитами на терр. совр.Турции. Покорено Ассирией",Турция
987,(AD 1620–1869),""">ДАТСКАЯ ИНДИЯ",ДАТСКАЯ ИНДИЯ (AD 1620–1869) Владение Дании. Образовано в результате основания Датской Ост-Индской компанией колоний в Индии. Столица — Форт Дансборг. Переданы Великобритании,Индия
638,"(AD 1219–1227},{1238–1346)",ДАТСКАЯ ЭСТЛЯНДИЯ,"ДАТСКАЯ ЭСТЛЯНДИЯ (AD 1219–1227},{1238–1346) Государство, монархическое (Герцогство Эстляндия). Владение Дании. (Зародилось на терр. совр. Эстонии в результате колонизации Северной Эстонии датчанами. Завоевано Орденом меченочцев},{Воссоздано. Вошло в состав Тевтонского ордена). Столица — Ревель.",Латвия Эстония
610,(AD 559–616),ДЕЙРА,"ДЕЙРА (AD 559–616) Государство, феодальное, монархическое. Основано англами на терр. совр. Великобритании (Северо-Восточная Англия). Столица не определена. Объединилось с Берницией в Нортумбрию.",Великобритания
931,"(1206–1526},{1539–1555)",ДЕЛИЙСКИЙ СУЛТАНАТ,"ДЕЛИЙСКИЙ СУЛТАНАТ (1206–1526},{1539–1555) Государство, феодальное, монархическое. (Зародилось на терр. совр. Индии в результате отделения от Государства Гуридов. Завоевано Империей Великих Моголов}, {Отделилось от Империи Великих Моголов. Завоевано Империей Великих Моголов). Столица — Дели.",Индия Пакистан
785,(AD 1918–1920),ДЕМОКРАТИЧЕСКАЯ РЕСПУБЛИКА АРМЕНИЯ,"ДЕМОКРАТИЧЕСКАЯ РЕСПУБЛИКА АРМЕНИЯ (AD 1918–1920) Государство, капиталлистическое. Образовано на терр. совр. Армении в результате отделения от Советской России. Столица — Ереван. После ввода советских войск и провозглашения советской власти преобразована в ССР Армения",Армения Турция
235,(AD 1010-1091),ДЕНИЙСКИЙ ЭМИРАТ,"ДЕНИЙСКИЙ ЭМИРАТ (AD 1010-1091) Государство, феодальное теократическое арабо-мусульманское. Зародилось на терр. совр.Испании в результате распада Кордовского Халифата. Столица — Дения. Завоевано Государством Альморавидов",Испания
712,"(AD 869–1071},{1157–1240)",ДЕРБЕНТСКИЙ ЭМИРАТ,"ДЕРБЕНТСКИЙ ЭМИРАТ (AD 869–1071},{1157–1240) Государство, феодальное теократическое, мусульманское. (Зародилось на терр. совр. России в результате распада Халифата Аббасидов. Завоевано Сельджукским Государством},{Воссоздано в результате распада Сельджукского Государства. Завоевано монголами и включено в состав Золотой Орды). Столица — Дербент.","Азербайджан Россия, (ЮФО)"
718,(AD 1747–1806),ДЕРБЕНТСКОЕ ХАНСТВО,"ДЕРБЕНТСКОЕ ХАНСТВО (AD 1747–1806) Государство, феодальное, мусульманское. Зародилось на терр. совр. России в результате распада Персидской Державы Надир-шаха. Вошло в состав Российской империи. Столица — Дербент.","Россия, (ЮФО)"
639,(AD 1224–1558),ДЕРПТСКОЕ ЕПИСКОПСТВО,"ДЕРПТСКОЕ ЕПИСКОПСТВО (AD 1224–1558) Государство, феодальное, теократическое (в составе княжества Терра Мариана, с 1435 в составе Ливонской конфедерации (в составе Священной Римской империи)). Образвано на терр. совр.Эстониив результате завоеваний Ордена меченосцев. Столица — Дерпт (нынешний Тарту). Завоевано Русским царством",Латвия Эстония
620,(AD 920–1197),ДЕХЕЙБАРТ,"ДЕХЕЙБАРТ (AD 920–1197) Государство, феодальное, монархическое. Образовалось на терр. совр.Великобритании (в Уэльсе) в результате объединения Диведа и Сейсиллуга. Столица — Диневур. Вошло в состав Гвинеда",Великобритания
98,(AD 1353–1432),ГОСУДАРСТВО ДЖАЛАИРИДОВ,"ГОСУДАРСТВО ДЖАЛАИРИДОВ (AD 1353–1432) Государство, феодальное. Образовано на терр. совр.Ирана в результате распада Государства Хулагуидов. Завоевано Государством Кара-Коюнлу",Турция
87,"(AD 1307–1393},{1402–1428)",ДЖАНИК,"ДЖАНИК (AD 1307–1393},{1402–1428) Государство, феодальное. (Образовано на терр. совр. Турциив результате отделения от Конийского Султаната. Завоевано Османским Эмиратом},{Восстановлен Государством Тамерлана. Завоевано Османским Эмиратом).",Турция
801,(AD 1747–1803),ДЖАРО-БЕЛОКАНСКОЕ ДЖАМААТСТВО,ДЖАРО-БЕЛОКАНСКОЕ ДЖАМААТСТВО(AD 1747–1803) Государственное образованиена основе кровного родства. Зародилось на терр. совр. Азербайджана в результате отделения от Кахетинского царства (перс.). Вошло в состав Российской империи.,Азербайджан
974,(AD 1399–1479),ДЖАУНПУРСКИЙ СУЛТАНАТ,"ДЖАУНПУРСКИЙ СУЛТАНАТ (AD 1399–1479) Государство, феодальное, монархическое. Зародилось на терр. совр. Индии в результате отделения от Делийского султаната. Столица — Джаунпур. Завоевано Делийским султанатом",Индия
133,"(AD 1921–1922},{1927–1936)",ДЖЕБЕЛЬ-ДРУЗ (фр.),"ДЖЕБЕЛЬ-ДРУЗ (фр.) (AD 1921–1922},{1927–1936) Мандатная территория Лиги наций под управлением Франции (AD 1921–1922 — Область Джебель-Друз, AD 1927–1936 — Государство Джебель-Друз). (Образована на терр. совр.Сирии. Отделилась от Дамаска (фр.). Переименована в Сувейду (фр.)}. {Образована в результате переименования из Сувейды (фр.). Вошла в состав Сирии (фр.)). Столица — Эс-Сувейда.",Сирия
