N,Годы,Название,Историческая справка,Страна
775,(AD 1994–),АБХАЗИЯ,"АБХАЗИЯ (AD 1994–) Самопровозглашенное, частично признанное государство, республика (Республика Абхазия). Образовано на части терр. совр.Грузии в результате отделения от Грузии. После российско-грузинской войны 2008 г. Россия признала независимость Абхазии. Столица — Сухум",Грузия
755,(AD 1462–1555),АБХАЗСКОЕ КНЯЖЕСТВО,"АБХАЗСКОЕ КНЯЖЕСТВО (AD 1462–1555) Государство, феодальное, монархическое. Возникло на терр. совр.Грузии в результате распада Грузинского царства. Столица — Сухум. Попало в вассальную зависимость от Османской империинезависимость Абхазии. Столица — Сухум",Грузия
758,(AD 1555–1810),АБХАЗСКОЕ КНЯЖЕСТВО (осм.),"АБХАЗСКОЕ КНЯЖЕСТВО (осм.) (AD 1555–1810) Государство, феодальное, монархическое, вассал Османской империи. Возникло на терр. совр.Грузии в результате попадания Абхазского княжества в вассальную зависимость от Османской империи. Столица — Сухум. Вошло в состав Российской империи",Грузия
749,(AD 786–100),АБХАЗСКОЕ ЦАРСТВО,"АБХАЗСКОЕ ЦАРСТВО (786–1008 AD) Государство, феодальное, монархическое. Зародилось на терр. совр.Грузии в результате отделения от Византийской империи. Вошло в состав Грузинского царства. Столица — Анакопии (Новый Афон), с 806 — Кутаиси",Грузия
714,(AD 1100–1240),АВАРСКОЕ ХАНСТВО,"АВАРСКОЕ ХАНСТВО (AD 1100–1240) Государство, феодальное теократическое, мусульманское. Зародилось на терр. совр.России. Образовано аварами. Завоевано монголами и включено в состав Золотой Орды. Столица — Хунзах",Россия Россия (ЮФО)
369,"(AD 562–623},{658–796)",АВАРСКИЙ КАГАНАТ,"АВАРСКИЙ КАГАНАТ (AD 562–623},{658–796) Государство, феодальное. (Зародилось на терр. совр. Венгрии в результате заселения кочевыми племенами авар части территории Византийской империи},{Завоевано Княжеством Само. Восстановлено в результате победы аваров над Княжеством Само. Уничтожен Франкским Государством)",Австрия Босния и Герцеговина Венгрия Румыния Сербия Словакия Словения Украина Хорватия Чехия
354,(AD 1804–1867),АВСТРИЙСКАЯ ИМПЕРИЯ,"АВСТРИЙСКАЯ ИМПЕРИЯ (AD 1804–1867) Государство, монархическое. Зародилось на терр. совр. Австрии в результате переименовании Габсбургской Империи. Столица — Вена. Преобразовано в Австро-Венгрию.",Австрия Венгрия Германия Италия Польша Румыния Сербия Словакия Словения Украина Хорватия Черногория Чехия
280,(AD 1713–1794),АВСТРИЙСКИЕ НИДЕРЛАНДЫ,"АВСТРИЙСКИЕ НИДЕРЛАНДЫ (AD 1713–1794) Государство, монархическое. Владение Австрийской Империи. Образовалось на терр. совр. Бельгии в результате перехода власти в Испанских Нидерландах к Австрийским Габсбургам. Столица — Брюссель. Присоединено к Франции",Бельгия Германия Люксембург Нидерланды
363,"(AD 1918–1938},{1945–)",АВСТРИЯ,"АВСТРИЯ (AD 1918–1938},{1945–) Государство, капиталистическое, республика (Австрийская Республика). (Зародилось на терр. совр. Австрии в результате распада Австро-Венгрии. Присоединено к Германии (аншлюс},{Освобождено созными войсками и восстановлена независимость). Столица — Вена",Австрия Италия
362,(AD 1867–1918),АВСТРО-ВЕНГРИЯ,"АВСТРО-ВЕНГРИЯ (AD 1867–1918) Государство, монархическое (Австро-Венгерская Империя). Зародилось на терр. совр. Австрии в результате переименовании Австрийской Империи. Столица — Вена. Распалась (На территории бывшей империи возникло несколько новых государств — Чехословакия, Польша, Австрийская республика, Венгрия; остальные регионы вошли в состав Румынии, Югославии и Италии.)","Австрия Албания Босния и Герцеговина Венгрия Италия Польша Россия
Россия (СЗФО) Румыния Сербия Словакия Словения Украина Хорватия Черногория Чехия"
914,(AD 1839–1963),"АДЕН (брит.)








ADEN (UK)","АДЕН (брит.) (AD 1839–1963) Владение Великобритании (до 1937 — входило в состав Британской Индии, с 1937 — коронная колония). Образовано на терр. совр. Йемена в результате отторжения Великобританией территории Адена от Лахеджа. Столица — Аден. Вошло в состав Федерации Южной Аравии (брит.)

ADEN (UK) (AD 1839–1963) Possession of the United Kingdom (until 1937 — was part of British India, 1937 — crown colony). Formed on the territory of Yemen as a result of exclusion from the UK territory of Aden Lahej. Capital — Aden. Joined the Federation of South Arabia (UK) /div>",Йемен
912,"(AD 1516–1538},{1547–1548)","АДЕН (порт.)





ADEN (Port.)","АДЕН (порт.) (AD 1516–1538},{1547–1548) Владение Португалии. (Зародилось на терр. совр. Йемена в результате завоевания Адена Португалией. Завоевано Османской импрерией},{Завоевано Португалией. Завоевано Османской импрерией) Столица — Аден

ADEN (Port.) (AD 1516–1538},{1547–1548) Possession of Portugal. (Arose in the territory of Yemen as a result of the conquest Aden by Portugal. Conquered by the Ottoman Empire},{Conquered by Portugal. Conquered by the Ottoman Empire). Capital — Aden",Йемен
805,(AD 1991–),АЗЕРБАЙДЖАН,"АЗЕРБАЙДЖАН (AD 1991–) Государство, республика (Азербайджанская Республика). Зародилось на терр. совр. Азербайджана в результате распада СССР. Столица — Баку",Азербайджан
803,(AD 1918–1920),АЗЕРБАЙДЖАНСКАЯ ДЕМОКРАТИЧЕСКАЯ РЕСПУБЛИКА,"АЗЕРБАЙДЖАНСКАЯ ДЕМОКРАТИЧЕСКАЯ РЕСПУБЛИКА (AD 1918–1920) Государство, капиталлистическое. Образовано на терр. совр. Азербайджана в результате отделения от Советской России. Столица — Баку. После ввода советских войск и провозглашения советской власти преобразована в Азербайджанскую ССР",Азербайджан
804,(AD 1918–1920),АЗЕРБАЙДЖАНСКАЯ ССР,"АЗЕРБАЙДЖАНСКАЯ ССР (AD 1920–1922, март) Государство, социалистическое (Азербайджанская Советская Социалистическая Республика). Образовано на терр. совр. Азербайджана в результате установления советской власти в Азербайджанской Демократической Республике. Столица — Баку. Вошло в состав Закавказской СФСР",Азербайджан
84,"(AD 1304–1390},{1402–1425)",АЙДЫН,"АЙДЫН (AD 1304–1390},{1402–1425) Государство, феодальное. (Образовано на терр. совр.Турции в результате отделения от Конийского Султаната. Завоевано Османским Эмиратом},{Восстановлен Государством Тамерлана. Завоевано Османским Эмиратом)",Турция
68,(AD 1171–1250),"АЙЮБИДОВ, ГОСУДАРСТВО","ГОСУДАРСТВО АЙЮБИДОВ (AD 1171–1250)Государство, феодальное. Образовано на терр. совр. Египта в результате государственного переворота в Халифате Фатимидов. Столица — Каир. В результате государственного переворота преобразовано в Государство Мамлюков","Алжир
Египет Израиль Иордания Ирак Иран Йемен Ливан Ливия Саудовская Аравия Сирия Турция"
96,(AD 1468–1508),"АК-КОЮНЛУ, ГОСУДАРСТВО","ГОСУДАРСТВО АК-КОЮНЛУ(AD 1468–1508) Государство, феодальное. Образовано на терр. совр. Иранав результате победы кочевых туркменских племен над Государством Кара-Коюнлу. Столица — Тебриз. Разгромлено Государством Сефевидо",Азербайджан Армения Иран Ирак Иран Сирия Турция
909,(AD 100–940),"АКСУМ








AKSUM","АКСУМ (AD 100–940) (AD 1839–1963) Владение Великобритании (до 1937 — входило в состав Британской Индии, с 1937 — коронная колония). Образовано на терр. совр. Йемена в результате отторжения Великобританией территории Адена от Лахеджа. Столица — Аден. Вошло в состав Федерации Южной Аравии (брит.)

AKSUM (AD 100–940) State slave, monarchic (Himyarite Kingdom of Aksum). Arose in the territory of Ethiopia. Disintegrated. Capital — Aksum",Йемен
517,(1900–1300 BC),АЛАСИЯ,"АЛАСИЯ (1900–1300 BC) Государство, рабовладельческое. Зародилось во время минойской цивилизации на терр.Кипра. Завоевано Хеттским царством",Кипр
713,(AD 900–1240),АЛАНИЯ,"АЛАНИЯ(AD 900–1240) Государство, рабовладельческое, монархическое. Зародилось на терр. совр. России, . Образовано аланами. Столица — Маас. Завоевано монголами и включено в состав Золотой Орды","Россия, (ЮФО),"
584,"(AD 1912–1914},{1920–1939},{1944–)",АЛБАНИЯ,"АЛБАНИЯ (AD 1912–1914},{1920–1939},{1944–) Государство капиталлистическое Республика Албания; в 1912–1914 — Государство Албания, в 1928–1939 — Королевство Албания, в 1946–1976 — Народная Республика Албания, в 1976–1991 — Народная Социалистическая Республика Албания). (Образовалось на терр. совр.Албании в результате отделения от Османской империи. Оккупировано Италией, Австро-Венгрией и Францией},{Вновь провозглашена независимость. Оккупировано Италией и преобразовано в Албанию (ит.), с 1943 оккупировано Германией},{Освобождено от оккупации.) Столица — Тирана",Албания
572,(AD 1939–1943),АЛБАНИЯ (ит.),АЛБАНИЯ (ит.) (AD 1939–1943) Колония (протекторат) Италии. Образована в результате оккупации ИталиейАлбании. Оккупирована Германией. Столица — Тирана,Албания Македония Сербия Черногория
26,(330–301 BC),"АЛЕКСАНДРА МАКЕДОНСКОГО, ИМПЕРИЯ

Empire Alexander the Great","ИМПЕРИЯ АЛЕКСАНДРА МАКЕДОНСКОГО (330–301 BC) Государство, рабовладельческое, монархическое. Зародилось на терр. совр. Греции. Создано Александром Македонским, путем завоевания Македонией Персидской Империи Ахеменидов. Столица — Вавилон. Распалась на ряд государств: Государство Селевкидов, Египет Птолемеев, Государство Лиссимаха",Азербайджан Албания Афганистан Бахрейн Болгария Греция Египет Израиль Индия Иордания Ирак Иран Казахстан Киргизстан Кипр Кувейт Ливан Ливия Македония Пакистан Румыния Сербия Сирия Таджикистан Туркменистан Турция Узбекистан
135,(AD 1924–1938),АЛЕКСАНДРЕТТА (фр.),АЛЕКСАНДРЕТТА (фр.) (AD 1924–1938) Мандатная территория Лиги наций под управлением Франции (Александреттский Санджак). Образована на терр. совр. Турции. Отделилась от Алеппо (фр.). Столица — Антиохия. Преобразована в независимое государство Хатай,Турция
129,(AD 1920–1925),АЛЕППО (фр.),"АЛЕППО (фр.) (AD 1920–1925) Мандатная территория Лиги наций под управлением Франции (Государство Алеппо). Образована на территории Сирии(зона брит.-фр. оккупации). Столица — Алеппо. Объединилось с Дамаском (фр.), образовав мандатную территорию Лиги наций под управлением Франции Сирию (фр.)",Турция Сирия
195,(AD 1962–),АЛЖИР,"АЛЖИР (AD 1962–) Государство, капиталистическое (Алжирская Народная Демократическая Республика). Образовано на терр. совр. Алжира в результате провозглашения независимости от Франции Алжиром (фр.). Столица — Алжир",Алжир
193,(AD 1711–1848),АЛЖИР (осм.),"АЛЖИР (осм.) (AD 1711–1848) Государство, вассал Османской Империи. Образовано на терр. совр.Алжира в результате отделения от Османской Империи. Столица — Алжир. Завоевано Францией — Алжир (фр.)",Алжир
181,(AD 1830–1962),АЛЖИР (фр.),"АЛЖИР (фр.) (AD 1830–1962) Объединение французских департаментов (Алжир, Константина, Оран). Образован на терр. совр. Алжира в результате завоевания Алжира (осм.), в 1848 включен в состав Франции. В 1962 г. провозглашена независимое Алжирская Республика",Алжир
233,(AD 1012-1104),АЛЬБАРРАСИНСКИЙ ЭМИРАТ,"АЛЬБАРРАСИНСКИЙ ЭМИРАТ (AD 1012-1104) Государство, феодальное теократическое арабо-мусульманское. Зародилось на терр. совр.Испании в результате распада Кордовского Халифата. Столица — Альбаррасин. Завоевано Государством Альморавидов",Испания
244,(AD 1012-1091),АЛЬМЕРИЙСКИЙ ЭМИРАТ,"АЛЬМЕРИЙСКИЙ ЭМИРАТ (AD 1012-1091) Государство, феодальное теократическое арабо-мусульманское. Зародилось на терр. совр.Испания в результате распада Кордовского Халифата. Столица — Альмерия. Завоевано Государством Альморавидов",Испания
234,(AD 1012-1103),АЛЬПУЭНТСКИЙ ЭМИРАТ,"АЛЬПУЭНТСКИЙ ЭМИРАТ (AD 1012-1103) Государство, феодальное теократическое арабо-мусульманское. Зародилось на терр. совр.Испания в результате распада Кордовского Халифата. Столица — Альпуэнте. Завоевано Государством Альморавидов",Испания
518,(669–570 BC),АМАТУС,"АМАТУС (669–570 BC) Город-государство, греческий. Образовался на терр. совр. Кипра в результате провозглашения независимости от Ассирии. Завоеван Египтом (Древним). Легендарным основателем города считается Кинир, отец Адониса и основатель культа Афродиты на острове, который назвал город в честь своей покойной матери Аматус (Аматеи)",Кипр
436,(AD 1945–1949),АМЕРИКАНСКАЯ ЗОНА ОККУПАЦИИ ГЕРМАНИИ,"АМЕРИКАНСКАЯ ЗОНА ОККУПАЦИИ ГЕРМАНИИ (AD 1945–1949) Образовалось на терр. совр. Германии . Часть территории Германии, оккупированная США в результате поражения Германии во 2-й мировой войне. На территории Британской, Французской и Американской зон оккупации провозглашена Федеративная Республика Германии. Штаб квартира оккупационных войск — Франкфурт",Германия
441,(AD 1945–1949),АМЕРИКАНСКИЙ СЕКТОР ОККУПАЦИИ БЕРЛИНА,"АМЕРИКАНСКИЙ СЕКТОР ОККУПАЦИИ БЕРЛИНА (AD 1945–1949) Образовалось на терр. совр. Германии. Часть территории Берлина, оккупированная США в результате поражения Германии во 2-й мировой войне.На территории Британского, Французского и Американского секторов оккупации создано особое политическое образование — Западный Берлин",Германия
19,(600–183 BC),АМИС,"АМИС (600–183 BC) Город-государство, колония, рабовладельческий, монархический. Основан древними греками на терр. совр.Турции. Завоеван Понтийским царством",Турция
144,(1350–732 BC),АММОН,"АММОН (1350–732 BC) Государство, рабовладельческое, монархическое. Находилось на терр. совр.Иордании. Образовано аммонитянами. Столица — Раббат-Аммон. Завоевано Ассирией",Иордания
272,"(AD 927–1014},{1042–1707)",АНГЛИЯ,"АНГЛИЯ (AD 927–1014},{1042–1707) Государство монархическое (Королевство Англия). (Зародилось на терр. совр.Великобритания Великобритании в результате объединения королем Уэссекса Этельстаном семи королевств: Уэссекс, Суссекс, Эссекс, Кент, Нортумбрия, Восточная Англия и Мерсия. Завоевано Данией},{Воссоздано. Объединилось с Шотландией, образовав Великобританию). Столица — Лондон",Великобритания Ирландия Кипр Франция
251,(AD 1278–),АНДОРРА,"АНДОРРА (AD 1278–) Государство, капиталистическое (Княжество Андорра). Образовалось на терр. совр. Андорры в результате отделения от Франции. Столица — Андорра-ла-Велья",Андорра
57,(AD 860–1045),АНИЙСКОЕ ЦАРСТВО,"АНИЙСКОЕ ЦАРСТВО (AD 860–1045) Государство, армянское феодальное, монархическое. Возникло на терр. совр.Турции в результате свержения власти Халифата Аббасидов княжеским родом Багратидов на большей части армянских земель. Столицы — Карс (до 961), Ани. Завоевано Византийской Империей",Азербайджан Армения Иран Турция
69,(AD 1098–1268),АНТИОХИЙСКОЕ КНЯЖЕСТВО,"АНТИОХИЙСКОЕ КНЯЖЕСТВО (AD 1098–1268) Государство, феодальное, монархическое. Образовано крестоносцами на территории Сельджукского Гоосударства (терр. совр. Сирии). Столица — Антиохия. Завоевано Государством Мамлюков.",Сирия Турция
431,(AD 1863–1871),АНХАЛЬТ,"АНХАЛЬТ (AD 1863–1871) Государство, монархическое (Герцогство Анхальт). Образовалось на терр. совр.Германии в результате объединения герцогств Анхальт-Бернбург и Анхальт-Дессау. В 1863–1866 — член Германского союза, в 1867–1871 — член Северогерманского союза. Вошло в состав объединенной Германии. Столица — Дессау",Германия
396,(AD 1806–1863),АНХАЛЬТ-БЕРНБУРГ,"АНХАЛЬТ-БЕРНБУРГ (AD 1806–1863) Государство, монархическое (Герцогство Анхальт-Бернбург). Образовалось на терр. совр. Германии в результате ликвидации Священной Римской империи (в составе Священной Римской империи образовано в 1803 в результате преобразования Княжества Анхальт-Бернбург). В 1807–1813 — член Рейнского союза, в 1815–1863 — член Германского союза. Вошло в состав объединенного Герцогства Анхальт. Столица — Бернбург",Германия
