N,Годы,Название,Историческая справка,Страна
250,(AD 1262-1342),КОРОЛЕВСТВО МАЛЬОРКА,"КОРОЛЕВСТВО МАЛЬОРКА (AD 1262-1342) Государство, феодальное. Зародилось на терр. совр. Испании(Балеарские о-ва) в результате отделения от Арагона. Столица — Пальма. Вошло в соста Арагона",Испания Франция
360,(AD 1816–1861),КОРОЛЕВСТВО ОБЕИХ СИЦИЛИЙ,"КОРОЛЕВСТВО ОБЕИХ СИЦИЛИЙ (AD 1816–1861) Государство, монархическое. Огбразовалось на терр. совр. Италии в результате объединения Неаполитанского Королевства и Сицилийского королевства. Столица — Неаполь. Вошло в состав объединенной Италии",Италия
259,(AD 493–553)),КОРОЛЕВСТВО ОСТГОТОВ,"КОРОЛЕВСТВО ОСТГОТОВ (AD 493–553) Государство, феодальное, монархическое. Зародилось на терр. совр. Италии в процессе распада Западной Римской Империи. Столица — Равенна. Завоевано Византийской империей",Австрия Босния и Герцеговина Ватикан Венгрия Италия Монако Сербия Словения Франция Хорватия Черногория Швейцария
623,(AD 1079–1266),КОРОЛЕВСТВО ОСТРОВОВ,"КОРОЛЕВСТВО ОСТРОВОВ (AD 1079–1266) Государство, феодальное, монархическое. Зародилось на терр. совр. Великобритании в результате отделения от Шотландии о. Мэн, Гебридских, Шетландских и Оркнейских. Столица не определена. Присоединено к Шотландии",Великобритания
613,(AD 580–843),КОРОЛЕВСТВО ПИКТОВ,"КОРОЛЕВСТВО ПИКТОВ (AD 580–843) Государство, феодальное, монархическое. Основано пиктами на терр. совр. Великобритании (в Шотландии). Столица не определена. Объединилось с Дал Риадом в Шотландию.",Великобритания
393,(AD 1806–1871) ),КОРОЛЕВСТВО САКСОНИЯ,"КОРОЛЕВСТВО САКСОНИЯ (AD 1806–1871) Государство, монархическое. Образовалось на терр. совр. Германии в результате ликвидации Священной Римской империи и преобразования Курфюршества Саксония. В 1806–1813 — член Рейнского союза, в 1815–1866 — член Германского союза, в 1867–1871 — член Северогерманского союза. Вошло в состав объединенной Германии. Столица — Дрезден",Германия Польша
328,(AD 1282–1816),КОРОЛЕВСТВО СИЦИЛИЯ,"КОРОЛЕВСТВО СИЦИЛИЯ (AD 1282–1816) Государство, феодальное, монархическое. Зародилось на терр. совр.Италии в результате переименования Королевства Апулия и Сицилия после отделения от него Неаполитанского Королевства. (В 1302–1416 называлось также Королевство Тринакрия). Столица — Палермо. Объединилось с Неаполитанским королевством, образовав Королевство Обеих Сицилий",Италия Мальта
560,(AD 1878–1918),КОРОЛЕВСТВО СЕРБИЯ,"КОРОЛЕВСТВО СЕРБИЯ (AD 1878–1918) Государство, капиталлистическое, монархия (до 1882 — княжество; в составе Османской империи существовало с 1817). Образовалось в результате отделения от Османской империи на территории совр. Сербии. Вошло в состав Королевства Сербов, Хорватов и Словенцев. Столица — Белград",Македония Сербия
473,(AD 1918–1929),"КОРОЛЕВСТВО СЕРБОВ, ХОРВАТОВ и СЛОВЕНЦЕВ","КОРОЛЕВСТВО СЕРБОВ, ХОРВАТОВ и СЛОВЕНЦЕВ (AD 1918–1929) Государство, капиталлистическое, монархия. Образовалось в результате распада Австро-Венгрии и Османской империи на территории совр. Сербии, Хорватии , Словении, Черногории , Македонии, Боснии и Герцеговины . Переименовано в Югославию.",Босния и Герцеговина Македония Сербия Словения Хорватия Черногория
379,(AD 450–531),КОРОЛЕВСТВО ТЮРИНГИЯ,"КОРОЛЕВСТВО ТЮРИНГИЯ (AD 450–531) Государство, феодальное. Зародилось на терр. совр.Германии в результате объединения германских племен тюринов. Столица — не установлена. Завоевано Франкским Государством",Германия
501,(AD 1204–1224),КОРОЛЕВСТВО ФЕССАЛОНИКИ,"КОРОЛЕВСТВО ФЕССАЛОНИКИ (AD 1204–1224) Государство, феодальное, монархическое. Зародилось на терр. совр.Греции. Образовано крестоносцами в результате 4 крестового похода на части территории Византийской империи. Столица — Фессалоники. Завоевано Эпирским деспотатом",Болгария Греция
586,(AD 1852–1918),КОРОЛЕВСТВО ЧЕРНОГОРИЯ,"КОРОЛЕВСТВО ЧЕРНОГОРИЯ (AD 1852–1918) Государство, капиталлистическое, монархия (до 1910 — княжество). Образовалось в результате отделения от Османской империи на территории совр.Черногории . Вошло в состав Королевства Сербов, Хорватов и Словенцев. Столица — Цетине",Сербия Черногория
352,(AD 1801–1807),КОРОЛЕВСТВО ЭТРУРИЯ,"КОРОЛЕВСТВО ЭТРУРИЯ (AD 1801–1807) Государство, дочернее королевство Франции. Образовано на терр. совр. Италии в результате преобразования Великого Герцогства Тоскана. Столица — Флоренция. Присоединено к Франции",Италия
591,(AD 2008–),КОСОВО,"КОСОВО (AD 2008–) Частично признанное государство, капиталистическое (Республика Косово). Образовалось на терр. совр. Сербии в результате отделения от Сербии. Столица — Приштина.",Сербия
20,(600–183 BC),КОТИОРА,"КОТИОРА (600–183 BC) Город-государство,колония, рабовладельческий, монархический. Основан древними греками на терр. совр.Турции. Завоеван Понтийским царством.",Турция
941,(1100–400 BC),КОШАЛА,"КОШАЛА (1100–400 BC) Государство, рабовладельческое, монархическое. Зародилось на терр. совр. Индии. Завоевано Магадхой",Индия
459,(AD 1815–1846),КРАКОВСКАЯ РЕСПУБЛИКА,"КРАКОВСКАЯ РЕСПУБЛИКА (AD 1815–1846) Государство, республика. Образовано на терр. совр.Польши под прямым покровительством Российской империи, Австрийской империи и Пруссии после раздела Варшавского герцогства. Присоединено к Австрийской империи. Столица — Краков",Польша
500,(AD 826-961),КРИТСКИЙ ЭМИРАТ,"КРИТСКИЙ ЭМИРАТ (AD 826-961) Государство, феодальное теократическое арабо-мусульманское. Зародилось на терр. о. Крит (совр.Греция) в результате завоевания острова арабами и отделения его от Византийской империи. Завоевано норманнами, образовавшими Графство Сицилия",Греция
302,(708–264 BC),КРОТОН,"КРОТОН (708–264 BC) Город-государство, рабовладельческий, монархический. Основан древними греками на терр. совр. Италии . Завоеван Римской Республикой.",Италия
662,"(AD 1441–1478},{1774–1783)",КРЫМСКОЕ ХАНСТВО,"КРЫМСКОЕ ХАНСТВО (AD 1441–1478},{1774–1783) Государство, феодальное, монархическое. (Зародилось на терр. совр. Украины в процессе распада Золотой орды на ряд независимых государств. Попало в вассальную зависимость от Османской империи},{Воссоздано как независимое ханство. Присоединено к Российской империи) Столица — Бахчисарай.","Молдавия Россия, (ЦФО), (ЮФО), Украина"
683,(AD 1478–1774),КРЫМСКОЕ ХАНСТВО (осм.),"КРЫМСКОЕ ХАНСТВО (осм.) (AD 1478–1774) Государство, вассал Османской империи. Образовано на терр. совр. Украины в результате попадания Крымского ханства в вассальную зависимость от Османской империи. Столица — Бахчисарай. Воссоздано как независимое ханство","Молдавия Россия, (ЦФО), (ЮФО), Украина"
1607,(AD 1607–1898),КУБА,КУБА (исп.) (AD 1607–1898) Колония Испании (генерал-капитанство). Создана на терр. совр. Кубы как часть Новой Испании. Столица — Гавана. Прекратила свое существование результате Испано-американская война и установления протектората США (в 1902 была провозглашена независимая Республика Куба,"Россия, (ЮФО)"
705,"(AD 1918, январь – 1920, март)",КУБАНСКАЯ НАРОДНАЯ РЕСПУБЛИКА,"КУБАНСКАЯ НАРОДНАЯ РЕСПУБЛИКА (AD 1918, январь – 1920, март) Несоветское осударство. Образовано на терр. совр. России в результате отделения от Советской России. Вошло в состав Советской России. Столица — Екатеринодар.","Россия, (ЮФО)"
799,(AD 1747–1806),КУБИНСКОЕ ХАНСТВО,"КУБИНСКОЕ ХАНСТВО (AD 1747–1806) Государство, феодальное, монархическое. Зародилось на терр. совр. Азербайджана в результате отделения от Персидской державы Надир-шаха. Вошло в состав Российской империи. Столица — Куба.",Азербайджан
887,"(AD 1961–1990},{1991–)",КУВЕЙТ,"КУВЕЙТ (AD 1961–1990},{1991–) Государство, монархическое (Эмират Кувейт). (Зардилось на терр. совр. Кувейта в результате провозглашения независимости от Великобритании. Оккупировано Ираком},{В ходе военной операции ""Буря в пустыне"" освобождено от оккупации). Столица — Эль-Кувейт",Кувейт
886,(AD 1899–1961),КУВЕЙТ (брит.),"КУВЕЙТ (брит.) (AD 1899–1961) Государство, феодальное, теократическое, мусульманское (Шейхство Кувейт), под протекторатом Великобритании. Зардилось на терр. совр. Кувейта в результате прехода протектората от Османской империи к Великобритании. Столица — Эль-Кувейт. 19 июня 1946 г. провозглашен независимый Эмират Кувейт",Кувейт
885,(AD 1752–1899),КУВЕЙТ (осм.),"КУВЕЙТ (осм.) (AD 1752–1899) Государство, феодальное, теократическое, мусульманское (Шейхство Кувейт), под протекторатом Османской империи. Зардилось на терр. совр. Кувейта в результате отделения от Османской империи. Столица — Эль-Кувейт. Перешло под протекторат Великобритании.",Кувейт
633,(AD 1180–1207),КУКЕЙНОССКОЕ КНЯЖЕСТВО,"КУКЕЙНОССКОЕ КНЯЖЕСТВО (AD 1180–1207) Государство, феодальное, монархическое, удельное княжество (вассал Полоцкого княжества). Основано славянами на терр. совр. Латвии. Столица — Кукейнос. Завоевано Орденом меченосцев",Латвия
296,(750–327 BC),КУМЫ,"КУМЫ (750–327 BC) Город-государство, рабовладельческий, монархический. Основан древними греками на терр. совр. Италии . Завоеван Римской Республикой.",Италия
522,(669–570 BC),КУРИОН,"КУРИОН (669–570 BC) Город-государство, греческий. Образовался на терр. совр.Кипра в результате провозглашения независимости от Ассирии. Завоеван Египтом (Древним)",Кипр
641,(AD 1234–1562),КУРЛЯНДСКОЕ ЕПИСКОПСТВО,"КУРЛЯНДСКОЕ ЕПИСКОПСТВО (AD 1234–1562) Государство, феодальное, теократическое (в составе княжества Терра Мариана, в 1435–1561 в составе Ливонской конфедерации (в составе Священной Римской империи)). Образвано на терр. совр. Эстонии в результате отделения от Ордена меченосцев. Столица — Пильтен. Передано во владение Дании",Латвия Эстония
939,(1200–800 BC),КУРУ,"КУРУ (1200–800 BC) Государство, рабовладельческое, монархическое. Зародилось на терр. совр. Индии в результате формирования государства у индоарийского племени кшатриев. Завоевано Панчалой",Индия
835,(AD 30–375),"КУШАНСКОЕ ЦАРСТВО

Kushan Empire","КУШАНСКОЕ ЦАРСТВО (AD 30–375) Государство, рабовладельческое, монархическое. Зародилось на терр. совр. Узбекистана в результате формирования государства у индоиранского народа тохаров. Столица — Бактра. Завоевано Персидской империей Сасанидов и Государством Гуптов",Афганистан Индия Киргизстан Пакистан Таджикистан Узбекистан
10,(1000–700 BC),КУЭ,"КУЭ (1000–700 BC) Государство, рабовладельческое. монархическое. . Зародилось на терр. совр. Турции. Вошло в состав Ассирии.",Турция
822,(AD 1035–1219),КЫПЧАКСКОЕ ХАНСТВО,"КЫПЧАКСКОЕ ХАНСТВО (AD 1035–1219) Государство, феодальное, монархическое. Зародилось на терр. совр. Казахстанa в результате перехода власти в Кимакском каганате к племенам ккыпчаков. Столица — Сыгнак. Завоевано Монгольской империей.",Казахстан Туркменистан Узбекистан
852,"(2500–2315 BC},{2150–2110 BC)",ЛАГАШ,"ЛАГАШ (2500–2315 BC},{2150–2110 BC) Шумерский город-государство, рабовладельческий, монархический. (Зародился на терр. совр. Ирака. Вошел в состав Шумера и Аккада}, {Вышел из состава Шумера и Аккада. Завоеван Уром)",Ирак
42,(196–188 ВС),ЛАМПСАК,"ЛАМПСАК (196–188 ВС) Город-государство, рабовладельческий, монархический. Образован на терр. совр.Турции. Вышел из состава Государства Селевкидов. Вошел в состав Пергамского царства. Город Лампсак — родина философа Эпикура (341–270 BC)",Турция
260,(AD 568–774),ЛАНГОБАРДСКОЕ КОРОЛЕВСТВО,"ЛАНГОБАРДСКОЕ КОРОЛЕВСТВО (AD 568–774) Государство, феодальное, монархическое. Зародилось на терр. совр. Италии в результате завоевания лангобардами районов Византийской Империи. Столица — Павия (позднее Милан, Монца). Завоевано Франкским Государством.",Ватикан Италия Словения Франция Хорватия Швейцария
523,(669–570 BC),ЛАПЕТОС,"ЛАПЕТОС (669–570 BC) Город-государство, греко-финикийский. Образовался на терр. совр.Кипра в результате провозглашения независимости от Ассирии. Завоеван Египтом (Древним)",Кипр
132,(AD 1930–1936),ЛАТАКИЯ (фр.),ЛАТАКИЯ (фр.) (AD 1930–1936) Мандатная территория Лиги наций под управлением Франции (Санджак Латакия). Образована на терр. совр.Сирии в результате переименования Государства Алавитов (фр.). Столица — Латакия. Вошла в состав Сирии (фр.),Сирия
645,(AD 1918–1920),ЛАТВИЙСКАЯ ССР,"ЛАТВИЙСКАЯ ССР (AD 1918–1920) Государство, социалистическое. (Латвийская Социалистическая Советская Республика). Образовано в результате освобождения территории совр.Латвииот германской оккупации и признания независимости Советской Россией. Столица — Рига. Прекратила свое существования в результате освобождения территории от Красной Армии Латвийской Республикой (независимость провозглашена 18 ноября 1918 г.)",Латвия
652,"(AD 1920–1940},{1991–)",ЛАТВИЯ,"ЛАТВИЯ (AD 1920–1940},{1991–) Государство, капиталлистическое, республика (Латвийская Республика). (Зародилось на терр. совр.Латвии в результате отделения от Советской России (независимость провозглашена 18 ноября 1918) и прекращения существования Латвийской ССР},{Вошло в состав СССР. Вышло из состава СССР). Столица — Рига",Латвия
71,(AD 1204–1261),ЛАТИНСКАЯ ИМПЕРИЯ,"ЛАТИНСКАЯ ИМПЕРИЯ (AD 1204–1261) Государство, феодальное, монархическое. Образовано на терр. совр.Турциикрестоносцами в результате завоевания части Византийской Империи. Столица — Константинополь. Ликвидирована Никейской Империей.",Болгария Греция Турция
913,(AD 1728–1869),"ЛАХЕДЖ




LAHEJ","ЛАХЕДЖ (AD 1728–1869) Государство, теократическое, мусульманское (Султанат Лахедж). Pfhjlbkjcm на терр. совр. Йемена в результате отделения от Йемена. Столица — Лахдж. Вошло в состав Протектората Аден (брит.)

LAHEJ (AD 1728–1869) State, theocratic, Muslim (Sultanate Lahej). Arose in the the territory of Yemen as a result of separation from Yemen. Capital — Lahij. Became part of the Aden Protectorate (UK)",Йемен
524,(669–570 BC),ЛЕДРА,"ЛЕДРА (669–570 BC) Город-государство, греческий. Образовался на терр. совр.Киправ результате провозглашения независимости от Ассирии. Завоеван Египтом (Древним)",Кипр
583,(AD 1444–1479),ЛЕЖСКАЯ ЛИГА,"ЛЕЖСКАЯ ЛИГА (AD 1444–1479) Конфедерация албанских княжеств. Создана на терр. совр.Албании в результате объединения Арианити, Дукаджини, Кастриоти, Княжества Албания, Музаки. Завоевана Османской империей. Столица — Лежа",Албания
403,(AD 1806–1814),ЛЕЙЕН,"ЛЕЙЕН (AD 1806–1814) Государство, монархическое (Княжество Лейен). Образовалось на терр. совр.Германии в результате ликвидации Священной Римской империи. Член Рейнского союза. Вошел в состав Австрийской империи. Столица — Хохенгерольдсэк",Германия
226,"(AD 924–1037},{1065–1072},{1157–1230)",ЛЕОН,"ЛЕОН (AD 924–1037},{1065–1072},{1157–1230) Государство, феодальное, монархическое (Королевство Леон). (Зародилось на терр. совр.Испаниив результате переименования Королевства Астурия. Объединилось с Кастилией, образовав Королевство Кастилия и Леон},{Восстановлено в результате отделения от Кастилии.Объединилось с Кастилией, образовав Королевство Кастилия и Леон},Восстановлено в результате отделения от Кастилии.Объединилось с Кастилией, образовав Королевство Кастилия и Леон). Столица — Леон.",Испания Португалия
165,(1100–600 BC),ЛЕПТИС-МАГНА,"ЛЕПТИС-МАГНА (1100–600 BC) Город-государство, колония, рабовладельческий, монархический. Основан финикийцами на терр. совр. Ливии Завоеван Карфагеном.",Ливия
